
    =========================== USB Port6 ===========================

Connection Status        : 0x01 (Device is connected)
Port Chain               : 2-6
Properties               : 0x09
 IsUserConnectable       : yes
 PortIsDebugCapable      : no
 PortHasMultiCompanions  : no
 PortConnectorIsTypeC    : yes
ConnectionIndex          : 6
CompanionIndex           : 0
 CompanionHubSymLnk      : USB#ROOT_HUB30#5&4087d53&0&0#{f18a0e88-c30c-11d0-8815-00a0c906bed8}
 CompanionPortNumber     : 2

      ======================== USB Device ========================

        +++++++++++++++++ Device Information ++++++++++++++++++
Device Description       : USB Module
Device Path              : \\?\usb#vid_4348&pid_55e0#6&3af0f9ce&0&6#{a5dcbf10-6530-11d2-901f-00c04fb951ed}
Device ID                : USB\VID_4348&PID_55E0\6&3AF0F9CE&0&6
Hardware IDs             : USB\VID_4348&PID_55E0&REV_0100 USB\VID_4348&PID_55E0
Driver KeyName           : {77989adf-06db-4025-92e8-40d902c03b0a}\0001 ({77989ADF-06DB-4025-92E8-40D902C03B0A})
Driver                   : \SystemRoot\System32\Drivers\CH375W64.SYS (Version: 3.5.2025.8  Date: 2025-08-21)
Driver Inf               : C:\Windows\inf\oem202.inf
Legacy BusType           : PNPBus
Class                    : WCH
Class GUID               : {77989adf-06db-4025-92e8-40d902c03b0a}
Interface GUID           : {a5dcbf10-6530-11d2-901f-00c04fb951ed} (GUID_DEVINTERFACE_USB_DEVICE)
Service                  : CH375_A64
Enumerator               : USB
Location Info            : Port_#0006.Hub_#0001
Location IDs             : PCIROOT(0)#PCI(0103)#PCI(0000)#USBROOT(0)#USB(6), ACPI(_SB_)#ACPI(PCI0)#ACPI(GPP2)#ACPI(PTXH)#ACPI(RHUB)#ACPI(POT6)
Container ID             : {5ba87b2d-d057-11f0-8eda-00e04c360276}
Manufacturer Info        : wch.cn
Capabilities             : 0xA4 (Removable, SilentInstall, SurpriseRemovalOK)
Status                   : 0x0180600A (DN_DRIVER_LOADED, DN_STARTED, DN_DISABLEABLE, DN_REMOVABLE, DN_NT_ENUMERATOR, DN_NT_DRIVER)
Problem Code             : 0
Power State              : D0 (supported: D0, D3, wake from D0)

        +++++++++++++++++ Registry USB Flags +++++++++++++++++
HKEY_LOCAL_MACHINE\SYSTEM\CurrentControlSet\Control\usbflags
 GlobalDisableSerNumGen  : REG_BINARY 00

        ---------------- Connection Information ---------------
Connection Index         : 0x06 (6)
Connection Status        : 0x01 (DeviceConnected)
Current Config Value     : 0x01
Device Address           : 0x61 (97)
Is Hub                   : 0x00 (no)
Device Bus Speed         : 0x01 (Full-Speed)
Number Of Open Pipes     : 0x02 (2 pipes to data endpoints)
Pipe[0]                  : EndpointID=2  Direction=IN   ScheduleOffset=0  Type=Bulk
Pipe[1]                  : EndpointID=2  Direction=OUT  ScheduleOffset=0  Type=Bulk
Data (HexDump)           : 06 00 00 00 12 01 10 01 FF 80 55 40 48 43 E0 55   ..........U@HC.U
                           00 01 00 00 00 01 01 01 00 61 00 02 00 00 00 01   .........a......
                           00 00 00 07 05 82 02 40 00 00 00 00 00 00 07 05   .......@........
                           02 02 40 00 00 00 00 00 00                        ..@......

        --------------- Connection Information V2 -------------
Connection Index         : 0x06 (6)
Length                   : 0x10 (16 bytes)
SupportedUsbProtocols    : 0x03
 Usb110                  : 1 (yes)
 Usb200                  : 1 (yes)
 Usb300                  : 0 (no)
 ReservedMBZ             : 0x00
Flags                    : 0x00
 DevIsOpAtSsOrHigher     : 0 (Is not operating at SuperSpeed or higher)
 DevIsSsCapOrHigher      : 0 (Is not SuperSpeed capable or higher)
 DevIsOpAtSsPlusOrHigher : 0 (Is not operating at SuperSpeedPlus or higher)
 DevIsSsPlusCapOrHigher  : 0 (Is not SuperSpeedPlus capable or higher)
 ReservedMBZ             : 0x00
Data (HexDump)           : 06 00 00 00 10 00 00 00 03 00 00 00 00 00 00 00   ................

    ---------------------- Device Descriptor ----------------------
bLength                  : 0x12 (18 bytes)
bDescriptorType          : 0x01 (Device Descriptor)
bcdUSB                   : 0x110 (USB Version 1.10)
bDeviceClass             : 0xFF (Vendor Specific)
bDeviceSubClass          : 0x80
bDeviceProtocol          : 0x55
bMaxPacketSize0          : 0x40 (64 bytes)
idVendor                 : 0x4348
idProduct                : 0x55E0
bcdDevice                : 0x0100
iManufacturer            : 0x00 (No String Descriptor)
iProduct                 : 0x00 (No String Descriptor)
iSerialNumber            : 0x00 (No String Descriptor)
bNumConfigurations       : 0x01 (1 Configuration)
Data (HexDump)           : 12 01 10 01 FF 80 55 40 48 43 E0 55 00 01 00 00   ......U@HC.U....
                           00 01                                             ..

    ------------------ Configuration Descriptor -------------------
bLength                  : 0x09 (9 bytes)
bDescriptorType          : 0x02 (Configuration Descriptor)
wTotalLength             : 0x0020 (32 bytes)
bNumInterfaces           : 0x01 (1 Interface)
bConfigurationValue      : 0x01 (Configuration 1)
iConfiguration           : 0x00 (No String Descriptor)
bmAttributes             : 0x80
 D7: Reserved, set 1     : 0x01
 D6: Self Powered        : 0x00 (no)
 D5: Remote Wakeup       : 0x00 (no)
 D4..0: Reserved, set 0  : 0x00
MaxPower                 : 0x32 (100 mA)
Data (HexDump)           : 09 02 20 00 01 01 00 80 32 09 04 00 00 02 FF 80   .. .....2.......
                           55 00 07 05 82 02 40 00 00 07 05 02 02 40 00 00   U.....@......@..

        ---------------- Interface Descriptor -----------------
bLength                  : 0x09 (9 bytes)
bDescriptorType          : 0x04 (Interface Descriptor)
bInterfaceNumber         : 0x00
bAlternateSetting        : 0x00
bNumEndpoints            : 0x02 (2 Endpoints)
bInterfaceClass          : 0xFF (Vendor Specific)
bInterfaceSubClass       : 0x80
bInterfaceProtocol       : 0x55
iInterface               : 0x00 (No String Descriptor)
Data (HexDump)           : 09 04 00 00 02 FF 80 55 00                        .......U.

        ----------------- Endpoint Descriptor -----------------
bLength                  : 0x07 (7 bytes)
bDescriptorType          : 0x05 (Endpoint Descriptor)
bEndpointAddress         : 0x82 (Direction=IN EndpointID=2)
bmAttributes             : 0x02 (TransferType=Bulk)
wMaxPacketSize           : 0x0040 (64 bytes)
bInterval                : 0x00 (ignored)
Data (HexDump)           : 07 05 82 02 40 00 00                              ....@..

        ----------------- Endpoint Descriptor -----------------
bLength                  : 0x07 (7 bytes)
bDescriptorType          : 0x05 (Endpoint Descriptor)
bEndpointAddress         : 0x02 (Direction=OUT EndpointID=2)
bmAttributes             : 0x02 (TransferType=Bulk)
wMaxPacketSize           : 0x0040 (64 bytes)
bInterval                : 0x00 (ignored)
Data (HexDump)           : 07 05 02 02 40 00 00                              ....@..

      -------------------- String Descriptors -------------------
             ------ String Descriptor 0 ------
bLength                  : 0x04 (4 bytes)
bDescriptorType          : 0x03 (String Descriptor)
Language ID[0]           : 0x0409 (English - United States)
Data (HexDump)           : 04 03 09 04                                       ....